ID,Headline,Date,Url,Source,Content
5a3eb26d7c459f246b63c979,Flying Saucers and Other Fairy Tales,2017-12-23,https://www.nytimes.com/2017/12/23/opinion/alien-encounters-christmas-ufo.html,The New York Times,"I am completely in favor of federal spending on U.F.O. research, an outlay whose existence was revealed to surprisingly little paranoid excitement by this newspaper last week. It is a sign of civilizational health to devote excess dollars to the scientific fringe, and to hope that bizarre secrets still await discovery even in our satellite-surveilled world. So good for Harry Reid and his little-green-men-obsessed billionaire pal for keeping the flame of weird curiosity alive.But I also doubt that such research will ever prove that the strange lights and vessels filmed by human pilots actually belong to a starfaring species that’s come to our planet to study, experiment and eventually offer us a hand up or else ruthlessly invade. Other sapient species may indeed be out there, but the most parsimonious explanation for all the U.F.O. encounters since Roswell is not that our nuclear testing or space program finally inspired the galaxy to come see what humanity is all about.Rather, it’s that our alien encounters, whether real or imaginary, are the same kind of thing as the fairy encounters of the human past — part of an enduring phenomenon whose interpretations shift but whose essentials are consistent, featuring the same abductions and flying crafts and lights and tricks with crops and animals and time and space, the same shape-shifting humanoids and sexual experiments and dangerous gifts and mysterious intentions.This was the argument of Jacques Vallée, a French-born scientist and a wonderful character in the annals of ufology, who wrote a wild book in the heady year of 1969 called “Passport to Magonia: From Folklore to Flying Saucers,” which The Times’s U.F.O.-spending scoop gave me an excuse to read.Vallée’s conclusion is basically the reverse of Erich von Däniken’s thesis in “Chariots of the Gods,” published to better sales the prior year. Where von Däniken argued that old myths and biblical tales alike contain evidence of ancient alien visitations (an idea picked up, most recently, by Ridley Scott’s “Alien” prequels), Vallée suggested that contemporary U.F.O. narratives are of piece with stories about Northern European fairies and their worldwide kith and kin — and that it’s more reasonable to think that we’re reading our space age preoccupations into a persistent phenomenon that might be much weirder than a simple visitation from the stars.This quasi-magical thesis made Vallée, as he put it, a “heretic among heretics” — the U.F.O. believer who rejected the U.F.O. community’s hope that their efforts could one day be incorporated into the normal sciences and lead us to some Spielbergian first contact. But his arguments for the basic continuity between folklore and flying saucers are quite compelling, and I suspect he’s correct about the commonality of these experiences …… Which is not, of course, to say that they reflect the genuine existence of some fifth-dimensional fairyland, from whence morally ambiguous beings emerge to play tricks upon our race. Certainly for most sensible secular scientific-minded people, to say that our era’s close encounters are of the same type as encounters with the unseelie court of faerie is to say that they are all equally imaginary, proceeding from internalized fancies and hallucinatory substances and late-night wrong turns, plus some common evolved subconscious that fears shape-shifting tricksters in modern Nevada no less than in the mists around Ben Bulben.But if this rationalist assumption seems natural these days, it is not necessarily permanent. The educated class of Victorian England went wild for fairies and spirits in the heyday of scientistic optimism, and both Vallée and von Däniken offered up their books amid the Age of Aquarius’s similar craze. (Just read Sally Quinn’s tales of murderous hexes in her recent memoir to recall how old-fashioned in their magical thinking the New Age’s devotees could become.)Sometimes our own elite opinion seems to be shopping for a new religion: I have read books in the last year pitching versions of Buddhism, pantheism and paganism to the post-Christian educated set. For such shoppers, the striking overlap between U.F.O.s and fairy stories might eventually become an advertisement for an updated spiritualist cosmology, not a strike against it — especially if woven together with multiverse and universe-as-simulation hypotheses that imply a kind of metaphysics of caprice.Meanwhile those of us who remain Christian — and yes, this is a Christmas column, U.F.O.s and all — can be agnostic about all these strange stories, not reflexively dismissive, since Christianity does not require that all paranormal experiences be either divinely sent or demonic or imaginary.Rather the Christian idea is that whatever capricious powers may exist, when the true God enters his creation, he does so honestly, straightforwardly, in a vulnerable and fully human form — and exposes himself publicly, whether in a crowded stable or on an execution hill. So the glamour of U.F.O.s, like the glamour of faerie, is an understandable object of curiosity but a dangerous object for any kind of faith. The only kind of God worth trusting is the kind who does not play tricks."
5b77e022068401528a2d49cf,Weekend Reads: 11 of Our Best Articles,2018-08-18,https://www.nytimes.com/2018/08/18/arts/weekend-reading-articles.html,The New York Times,"Welcome to the weekend. Maybe you’re off to a garage sale or maybe you’re a teacher getting one last spa day in before school starts. Whatever you’re doing, put Aretha Franklin on blast, get it done and read some fantastic journalism.With hits like “Respect” and “Chain of Fools,” she defined a female archetype: sensual and strong, long-suffering but ultimately indomitable. Obituaries[Listen to 20 essential songs by Ms. Franklin]____After setting off a furor that unsettled the markets and his own board, the Tesla chief talks about the pressure he is under and his struggle to cope. Business____Power. Innovation. Identity. Madonna has blended all of these and much more into a singular career in music, fashion, movies and beyond that’s crossed boundaries and obliterated the status quo. For her 60th birthday on Thursday, our writers assessed her broad and deep influence. Arts____The problem-plagued effort to restore electric service after the storm blacked out the whole island last year is finally reaching the last few darkened homes, officials say. National____A group in Los Angeles has attracted U.F.O. enthusiasts from all over the world. They’ve formed together around the common question: What are these things in the sky, exactly, and how can they know more about them? Surfacing____Walmart and other companies are using aggressive legal tactics to get their money back, demanding payments even when people haven’t been convicted of wrongdoing. Business____That’s why the president revoked my security clearance, Mr. Brennan writes: to try to silence anyone who would dare challenge him. Opinion____My son and his cubes have been inseparable for years. Like hundreds of other children, he found his tribe at the CubingUSA nationals. Sports____The former Trump campaign chairman’s trial has ripped away the facade of a man who worked for the campaign for free, intimating he was too rich to need the money. Washington____They were the topic of many conversations about my heritage — and the bane of my existence. But when I decided to embrace my brows, they became my secret weapon. Style____Ms. Tlaib, who won a Democratic primary in Michigan, may become the first Muslim woman in Congress. She said her upbringing shaped her political vision. Politics____"
5a47e9607c459f246b63d4e5,Dad Believed in U.F.O.s. Turns Out He Wasn’t Alone.,2017-12-30,https://www.nytimes.com/2017/12/30/sunday-review/dad-believed-in-ufos-turns-out-he-wasnt-alone.html,The New York Times,"The year now ending has been so laden with tumultuous news that one astounding report in the exhausted final days of 2017 seemed almost routine: that for years, an intelligence official burrowed within the Pentagon warren was running a secret program to investigate reports of unidentified flying objects.Beg your pardon?That scoop, by Helene Cooper, Ralph Blumenthal and Leslie Kean for The New York Times, was underscored by a companion article that detailed how in 2004 an oval object played a game of aeronautic hide-and-seek off Southern California with two Navy fighter jets assigned to the aircraft carrier Nimitz. The object then zipped away at a speed so otherworldly that it left one of the Navy pilots later saying he felt “pretty weirded out” — as you might if you watch the video of the encounter that the Department of Defense has made public.In considering these reports, my mind turned to all those reasonable people who were dismissed and ridiculed over the years because they believed that something was out there. I thought in particular of believers who had died without savoring these official revelations.Believers like my late father.I can hear what he would have said, there at the veterans’ home, his broken vessel of a body in a wheelchair but his mind as quick and bright as a shooting star. “I’ve been saying it for years,” he’d assert, followed by a choice epithet he reserved for government officials, followed by, “I knew it.”Then, a satisfying drag on a cigarette.My father, Gene, finished high school at night and served three years in the Army; he did not attend college. But he had a fearsome intellect, read voraciously and developed a command of such subjects as American history, numismatics — and U.F.O. investigations. Through the 1960s and 1970s, he joined many others in monitoring reports of aerial anomalies, tracking down reams of redacted official reports and swapping theories about credible sightings and government cover-ups.They bandied about the names of well-known U.F.O. researchers — J. Allen Hynek, Donald Keyhoe, Stanton Friedman — and read the latest newsletters from an organization called the National Investigations Committee on Aerial Phenomena, or Nicap. They remained resolute, even when many others gave up the cause after an Air Force-funded report in 1969 concluded that further study of U.F.O.s was unlikely to be of much scientific value, leading to the termination of the official Air Force program investigating the subject.To the likes of Gene Barry, the report was merely part of the cover-up.He was no astronomer or physicist. Just a working stiff who endured the anonymous drudgery of a daily commute but then, at night, often felt connected to something larger than himself, larger than all of us. While his neighbors focused on the fortunes of the New York Jets, he was contemplating whether the “wheel in the middle of a wheel” mentioned in the Book of Ezekiel referred to a flying object of some kind. If so, just consider the implications!In our family, the horizontal line separating earth and sky often blurred. My father’s supernaturally patient wife and four impressionable children carried small blue membership cards for a research and investigative organization called the Mutual U.F.O. Network, or Mufon. We applauded my father when he spoke at a U.F.O. symposium at a local university. At his behest, my sister Brenda even brought a blueprint for a spacecraft that he had received in the mail — mysterious packages often arrived in the mail — to Sts. Cyril and Methodius parochial school to ask her science teacher what he made of it.The teacher handed it back without a word.In other households of the 1960s, Barney and Betty referred only to the Rubbles of Bedrock, loyal neighbors of Fred and Wilma Flintstone. But in our home, those names might also refer to Betty and Barney Hill, a New Hampshire couple who claimed to have been abducted and examined by aliens in 1961.Then there were the family outings. Every so often our parents would pack us into the Chevy station wagon for a nighttime drive to that rare Long Island hill with an unimpeded view of the sky, or to Wanaque, N.J., 70 miles away, where strange lights were said to have been hovering over a local reservoir.Gradually, we children would doze off, our necks stiff from craning. My mother, the tolerant sidekick and chauffeur, would light another cigarette, while my father continued to train his cheap binoculars on the celestial infinity, confident in the certainty of the still uncertain.Over the years, life on terra firma intruded. Career setbacks, sickness, that daily anonymous grind. My father’s unofficial cell of believers quietly disbanded — exhausted, perhaps, by government silence and the false reports caused by weather balloons, satellites and people just seeing things. Then, when my mother died in 1999, he lost the person who grounded him, the Betty to his Barney.He died in 2008, still believing without having seen, still questioning the government, still marveling at the arrogance of those who insisted we were the only intelligent life in the universe.A decade passed, and then came this month’s report of a secret Pentagon program with the delightful name of the Advanced Aerospace Threat Identification Program. Funded by the government between 2007 and 2012, the program investigated aerial threats that included “unidentified aerial phenomena,” or U.A.P.s — which is just a less-polarizing way of saying U.F.O.s.To hardened veterans of the U.F.O. wars, the news of the government program was less surprising than it was validating. And the video of the encounter between Navy fighter jets and an unidentified object moving at extraordinary velocity provided a helpful visual to the cause of those U.F.O. groups with long acronyms.“Very interesting, very interesting,” said Fran Ridge, the archivist of the research accumulated by Nicap, now defunct. “But the very first thing that entered my mind was — why now? Is this a distraction? Is this something to get the people’s attention off politics?”Mr. Ridge’s skeptical words reminded me of my father, who half-joked that he believed in a conspiracy — about everything.“Finally, the kimono is being opened a little,” said Jan Harzan, the director of Mufon. “Personally, I don’t need verification from the government. But for the mass public, it’s important to know that there is advanced technology in our skies.”The news of the Pentagon’s program received a stunning amount of attention that included the usual dismissive commentary.“Call me when you have a dinner invite from an alien,” the celebrated astrophysicist Neil deGrasse Tyson said on CNN, a comment that would have driven my father to distraction. Classic redirection, he would have railed, the tip of his cigarette reddening with rage.But my father would also have nodded in agreement to what the good astrophysicist had to say about that almost playful aerial anomaly captured on government video. “It’s a flying object and we don’t know what it is,” Dr. Tyson said. “I would hope somebody’s checking it out.”Exactly, the old man would have grunted. Been saying it for years.An earlier version of this article misspelled the surname of the director of Mufon. It is Jan Harzan, not Harden."
5a4747dc7c459f246b63d441,"Pandas, U.F.O.s and Other Curiosities from Britain’s National Archives",2017-12-30,https://www.nytimes.com/2017/12/30/world/europe/britain-national-archives-panda-margaret-thatcher.html,The New York Times,"LONDON — The sporadic release of documents from Britain’s National Archives gives a glimpse into the country’s inner workings. For instance, there was the revelation that Prime Minister Margaret Thatcher debated using the military to quell a miners’ strike in 1984.The archives are a repository of both the historical and the mundane, storing everything from Shakespeare’s will to countless government tweets.And then there are the more offbeat offerings: Britons learned on Friday, in the government’s latest release, about Mrs. Thatcher’s refusal to travel with a panda. Previous released included disclosures about leftover moon dust (found in a cupboard), a report concerning U.F.O.’s (there were none) and Princess Margaret’s hoped-for marriage (no government opposition).Here are some of the quirkiest revelations from recent years.“I’m not taking a panda with me,” Mrs. Thatcher scribbled on a memo about the financial struggles of London Zoo. “Pandas and politicians are not happy omens!”The note came after the president of the zoo, Lord Zuckerman, contacted Mrs. Thatcher through a cabinet minister with a plea for financial help. Lord Zuckerman proposed that Mrs. Thatcher take a panda “in the back of her Concorde” on her first visit with President Ronald Reagan.The trip would have been a chance for the Smithsonian’s National Zoo in Washington to borrow London’s male panda to mate with its female panda. But Mrs. Thatcher was having none of it.When America’s Apollo 11 astronauts returned to Earth, they brought with them 48 pounds of rocks from the moon’s surface. President Richard M. Nixon presented Harold Wilson, the prime minister, with a sampling during a meeting in Washington in 1970.The four tiny pebbles mounted on an a commemorative wooden plaque first went on loan to the Science Museum in London, but as successive prime ministers struggled to find an appropriate spot to display it, the gift languished in a cupboard for years.Files from other departments, like the Ministry of Defense, provide interesting details about Britain’s security concerns through the past century, including those involving unidentified flying objects.The ministry received drawings, reports of sightings and questions from concerned citizens over several decades, papers released in several batches through the National Archives showed.“No U.F.O./flying saucer has landed in the vicinity of Menwith Hill and the base had no connection with U.F.O. research,” the ministry once replied to local farmers who reported sighting a disc-shaped object.The U.F.O. files are available for browsing on the National Archives website.Anthony Eden, who briefly served as prime minister in the 1950s, did not seem poised to stand in the way of a potential marriage between Princess Margaret, Queen Elizabeth II’s sister, and Group Capt. Peter Townsend. Even as the royal family was navigating what it would mean for Princess Margaret, then third in line for the throne, to wed Mr. Townsend, who was divorced, the government was coming up with plans to support the marriage.Mr. Eden’s government would have allowed Princess Margaret to keep her royal title.“The government was looking for ways of enabling her to marry,” an official at the National Archives told the BBC after government papers were released after the death of the princess.When Prime Minister Guy Mollet of France visited Britain during the Suez Crisis in 1956, he had a surprising suggestion, according to papers from the National Archives seen by the BBC in 2007. He proposed a union between the two countries.Later, when Mr. Eden was in Paris, Mr. Mollet reiterated the proposal and said that France would be happy to join the Commonwealth.The documents had been declassified years before, but, the BBC said, nobody noticed them until 2007.A suggestion to relocate Hong Kong residents after the territory’s return to China, in 1997, once inadvertently reached the Foreign Office.A Belfast newspaper published the proposal, by a lecturer in Northern Ireland, that the population be moved to a theoretical city-state to be created in Magilligan, between Coleraine and Londonderry. The piece provoked a flurry of correspondence between an official in Northern Ireland and one in Britain’s Foreign Office.But the Foreign Office official told the BBC it had been nothing more than a joke between colleagues.“Sadly, it’s impossible to make jokes like this any more,” the official, by then retired, told the BBC when the correspondence was revealed. “The Diplomatic Service has lost its sense of humor.”"
5b31c858068401528a2b8146,What’s on TV Tuesday: ‘A Quiet Place’ and ‘The Endless’,2018-06-26,https://www.nytimes.com/2018/06/26/arts/television/whats-on-tv-tuesday-a-quiet-place-and-the-endless.html,The New York Times,"A family leads a silent, isolated life in the sci-fi horror “A Quiet Place.” And two brothers return to their dark pasts in “The Endless.” A QUIET PLACE (2018) on iTunes, Amazon, FandangoNOW, Google Play and Vudu. John Krasinski (“The Office”) directs and stars in this nail-biting horror movie in which a family lives in a post-apocalyptic town taken over by blind monsters who navigate by sound. The only way to survive is to keep quiet, which is easier said than done. Emily Blunt (Mr. Krasinski’s real-life wife), Noah Jupe and Millicent Simmonds put on impeccable performances — when Ms. Blunt falls with a loud bang, we fear for her life as we would for our own. In her review for The New York Times, Jeannette Catsoulis named the film a Critic’s Pick and wrote that Mr. Krasinski “directs with skill and restraint,” adding, “He knows that when the sound is turned down, we lean in, and he forces us to pay attention to facial expressions in a way that hearing audiences are rarely required to do.”ELEVATOR TO THE GALLOWS (1961) on iTunes, Amazon and FilmStruck. This debut feature by the French director Louis Malle follows Florence (Jeanne Moreau) and her lover, Julien (Maurice Ronet), whose plot to murder Florence’s husband goes awry when Julien gets stuck in an elevator. As he attempts to escape, he gets entangled with another crime when a young couple steal his car. All the while a clueless Florence roams the streets of Paris, convinced Julien abandoned her. If a black-and-white melodrama isn’t up your alley, enjoy the timeless score by Miles Davis.W. KAMAU BELL: PRIVATE SCHOOL NEGRO (2018) on Netflix. Like many stand-up comedians, the Emmy Award-winning comic W. Kamau Bell has plenty to say about the Trump administration. In his first Netflix special, Mr. Bell, the provocative host of “United Shades of America,” riffs on racism and explains how his daughters make sense of today’s political climate.THE ENDLESS (2018) on iTunes and Amazon. In this thriller, the directing duo Aaron Moorhead and Justin Benson star as brothers (also named Aaron and Justin) who escaped a U.F.O. death cult a decade earlier. When they receive a cryptic message from a former cult member, the brothers return for a weekend to get closure. Inexplicable phenomena at the camp soon blur the lines between fantasy and reality. “The movie is shot in a realistic, grounded style that makes the unusual characterizations credible and the insane events convincing,” Glenn Kenny wrote for The Times in his review of this film, which he named a Critic’s Pick.CHOPPED 9 p.m. on Food Network. Martha Stewart joins the longtime judges Marc Murphy and Chris Santos in the season premiere of this cooking competition. With $10,000 on the line, four contestants prepare mouthwatering meals using surprise ingredients. This episode’s theme confines their big ideas to small plates."
