ID,Headline,Date,Url,Source,Content
597ebce27c459f246b61bd47,"‘Twin Peaks’ Season 3, Episode 12: Hornes Aplenty",2017-07-31,https://www.nytimes.com/2017/07/31/arts/television/twin-peaks-season-3-episode-12-recap.html,The New York Times,"Because “Twin Peaks” doesn’t take place in the “real world” per se, it’s been fascinating in this revival to see just what aspects of modern life David Lynch and Mark Frost see fit to include in their story. I’ve already mentioned the unusually futuristic computers in the otherwise retro Twin Peaks police station; but throughout the series so far there’ve been more conventional signs that it’s taking place in the 2010s. The Double R Diner now touts its “RR2GO” service, for example; and at the Great Northern, Ben Horne is taken aback when he receives Agent Cooper’s old room key in the mail, because the hotel hasn’t used metal keys in years.Along those same lines, early in this week’s episode, Sarah Palmer is at the store buying the ingredients for what’s going to be a very potent pitcher of Bloody Marys when she gets thrown off by the assortment of fancy jerkies behind the counter. Meanwhile, behind her in the shot, there’s a sign advertising “Artisan Bread,” and a shelf containing Jim Beam’s high-end small batch bourbon Knob Creek.In other words: Sarah, who once upon a time was an upstanding housewife from one of the most prominent families in the quaint, resolutely American town of Twin Peaks, suddenly realizes that she’s living in a community that’s become fashionable, up-to-date and taken over by the young. And it freaks her out.That’s not the only thing bothering Sarah, of course. She has a long history of psychic disturbances, dating from the original run of “Twin Peaks.” Later, when Deputy Chief Hawk Hill stops by to check on her, Lynch makes sure to show the Palmer house’s ominous ceiling fan, which spoke menacingly to Laura Palmer in the movie “Fire Walk With Me.” And while Hawk’s at the doorstep, he hears an unexplained noise in the house that Sarah waves off as just “something in the kitchen.” Clearly, all is not well there.Still, part of what’s off is that the world is changing. And over and over, this episode sets the old against the new, while marveling at the contrasts.Sometimes Lynch and Frost do it for comic effect, as in one brief scene where Sonny Jim drags Dougie out to his Vegas backyard for an good ol’ game of catch, and promptly bounces the baseball off his fake-dad’s head. At other times, the references to the modern world are fraught with irony, like when Chantal and Gary Hutchens assassinate Warden Murphy and then announce their plans to go get some Wendy’s. And sometimes the show uses modernity for simple plot convenience, such as having Diane use her cellphone to enter coordinates that point her to Twin Peaks.Mostly, the episode strikes a wistful tone. The momentum that’s energized the show in recent weeks continues, as the plot keeps driving the characters to an inevitable reunion. But this hour also pauses to reflect and to call back to old legacies and traditions.For example, Gordon and Albert finally explain why they use the term “Blue Rose” for their more paranormally inclined cases, initiating Agent Preston into their secret society by telling her that the Blue Roses are connected to the canceled U.F.O. investigation “Project Blue Book.” Then they call in Diane — who emerges from a thick, reddish-hued curtain that looks unnervingly like the décor in the Black Lodge — and deputize her in the Blue Rose-worthy hunt for Agent Cooper, to which she growls, “Let’s rock,” just like the Man From Another Place did back on the original show.The most substantial return to the past though involves the Horne family. When Sheriff Truman delivers the news about the murderous Richard Horne to his grandfather Ben — prompting a mournful reverie about Ben’s old green Schwinn bicycle, and a lament that Richard grew up without a father — “Twin Peaks” devotees might’ve recalled for the first time in weeks that there’s been one key Horne conspicuously absent this season.And then — so unceremoniously that it takes a moment to register her presence — the missing Horne appears for the first time. Sherilyn Fenn, playing Audrey Horne, has an elliptical five-minute conversation with the character actor Clark Middleton, who plays her husband, Charlie. They talk about people we may or may not have met yet, named Tina and Paul; and throughout Audrey expresses her worry about the disappearance of the man she’s been sleeping with, “Billy” (who could be the recently supernaturally slain South Dakotan William Hastings, or could be someone else entirely).If there was important information in that scene, it was hard to register, because it’s just such a delight to get some sense of what Audrey’s been up to (even though she looked pretty unhappy). It’s not entirely fair to judge a work of art based on knowledge beyond what’s inside the frame, but surely Lynch and Frost were aware of how excited die-hard “Twin Peaks” fans would be to see Audrey again ... which is why they were able to bring her back in a scene that otherwise adds little to the plot.Similarly, the preponderance of actors on this show who died not long after the shoot keeps adding a poignancy to the proceedings, which the creators are clearly exploiting — and not cheaply. The other standout scene comes when Albert drops by Gordon’s room to fill him in on what Diane’s been texting. He catches his boss sharing a glass of his excellent Bordeaux with a French lady he apparently met down in the hotel bar. The unnamed date (amusingly played by Bérénice Marlohe) fusses with her dress’s hemline, her tiny sweater and her makeup compact, taking forever to leave the room. After she’s gone, Gordon tells a punny story about her, which Albert greets with his usual stone face.But then, in the midst of the two old friends’ exchange, there’s a long pause, and a gesture of quiet concern from Cole to Rosenfield. For a moment it doesn’t feel as if we’re watching two longtime “Twin Peaks” characters share a moment together. It feels more as if Lynch, the director, is expressing genuine compassion for the actor Miguel Ferrer, who had throat cancer during production, before ultimately dying in January of this year.Extra Doughnuts:• Speaking of dear old friends, many thanks to Scott Tobias — whom I’ve known for over 25 years now — for filling in for me last week while I was on vacation. I’ve nothing to add to his excellent review of a very good episode, except to note one detail Scott may have missed (given that he hasn’t been as immersed in “Twin Peaks” as I have over the past few months). The spot where Gordon and Albert find the body of Ruth Davenport — and where Bill Hastings gets his head squished into goo by a woodsman — has an address that includes the word “Sycamore.”That connects both to the haunting original song “Sycamore Trees” that Jimmy Scott sings in the original series finale, and to the circle of 12 sycamores in Glastonbury Grove that’s a portal to the Black Lodge. It seems that if you want to visit the dark other-world where mystical entities dwell, the first thing to do is look for sycamores. (There’s also a King Arthur connection to sycamore trees, which ties into this show’s fairly stealthy Arthurian motif… but that’s something to address later on this season, if it proves relevant.)• In “Fire Walk With Me,” Carl Rodd seems like a fairly cantankerous fellow, but here he’s been a total sweetheart, showing compassion for the residents of the town and the denizens of his trailer park. This week he gives his resident handyman a break on rent, because he’s heard the man is selling his blood to make ends meet. That’s a refreshing flash of kindness in a show where people are often cruel. (Also, not to be morbid, but watching this series populated by so many actors who’ve died, I have to keep reminding myself that Harry Dean Stanton’s still with us.)• Our musical guest at the Bang Bang Bar this week is Chromatics, singing a song called “Saturday.” More significant (perhaps), the roundhouse coda introduces yet another batch of previously unseen Twin Peaks residents, dealing with their own seemingly unrelated-to-the-main-plot personal relationship drama, again featuring people we’ve never heard of.It’s interesting that this scene comes so soon after Audrey’s testy conversation with Charlie, in which she also tosses out a bunch of names that may or may not matter to the story. It may be that all of these offscreen characters will come into play in the next few weeks. But given that we’re two-thirds of the way through the season, it’s more likely these new folks — all of whom are apparently in some kind of terrible trouble — are just meant to illustrate how the world these characters inhabit is deeply troubled."
591525a97c459f24986df20e,Sometimes It Is All Just Fun and Games,2017-05-12,https://www.nytimes.com/2017/05/11/business/stan-weston-gi-joe-barbie-frisbee-monopoly.html,The New York Times,"Toys can be mirrors of society, often invented in response to events and trends, sometimes created to divert attention from what may be happening at the time.The military action figure G.I. Joe, for example, came out of the Cold War, when patriotism was running high in the United States after victory in World War II and the rise of the Soviet Union. Its creator, Stan Weston, died last week.Here are some other classic toys and their mark on American culture.BarbieBarbie changed everything that toymakers thought they knew about children when she strutted into little girls’ hands in 1959.At 12 inches tall with a scantily clad, curvaceous body and stiltlike legs, she flew off shelves and quickly became a cultural flash point over body image.No longer were girls seeking out baby dolls; Barbie, a teenage fashion model, inspired them to imagine their grown-up lives. Besides wearing ball gowns and wedding dresses, she evolved to hold more than 100 occupations, complete with dozens of uniforms, outfits and accessories.“Barbie wasn’t so expensive; it was getting her all the clothes and houses and cars and accessories that built this whole business model in the 1960s,” said Chris Bensch, a curator at the Strong, a museum in Rochester dedicated to the history of toys and play. “Barbie fit with the consumer culture after World War II, as well as this huge demographic of baby boom kids, with parents who had solid enough jobs that they could buy nice gifts.”Cabbage Patch KidsThey were chubby-cheeked and chinless, but the dolls became wildly popular in the 1980s in part because of how they were made, with computers that generated random combinations of hard plastic heads with plush bodies. A wide range of skin tones, eye colors and hair types made each of the dolls unique. They even came with names, birth certificates and adoption papers. Of the three million Cabbage Patch Kids sold in 1984 alone, no two were alike, according to Toys and American Culture: An Encyclopedia.The production lines could hardly keep up with the demand, and shoppers were said to brawl over them in toy store parking lots.“Barbie represents the perfect golden Californian: No warts. No pimples. The kind of girl every kid perhaps would like to grow up to be,” Arnold Greenberg, the chief executive of Coleco, which manufactured the Cabbage Patch line, told The New York Times in 1985. But, he said, “Cabbage kids are all different.”“They are not perfect,” he said. “They represent you and me with all our warts. They are almost antihero.”The FrisbeeThe popular belief is that Frisbees — sometimes also called Flying Saucers — were created in the 1950s, after Americans became obsessed with accounts of U.F.O. sightings in Roswell, N.M. But flying discs were being tossed long before then — although they weren’t actually toys, but metal pie trays. As recounted by Toys and American Culture, students at Yale University would finish their treats from the nearby Frisbie Pie Company in New Haven and toss the empty dishes back and forth, shouting “Frisbie!” to warn bystanders.It was Walter Morrison, a former World War II military pilot, and his friend Warren Franscioni who improved the design and marketed the resulting disc as a toy. At first they tried to tap into the growing public fascination with extraterrestrials by giving the disc names like Pluto Platter. Eventually, though, they reverted to calling the toy simply Frisbee.Early on, to help business, Mr. Morrison and Mr. Franscioni demonstrated the toys’ aerodynamic capabilities on college campuses, but observers were skeptical, said Mr. Bensch, the toy museum curator.“They didn’t believe it could do the things it did, and thought it had to have an invisible wire,” he said. So the company offered the toy free but said the invisible wire would cost a dollar. Before long, there seemed to be one on every roof.The Hula HoopThe craze that first twirled its way into postwar American backyards in 1958 began when two toymakers, Spud Melin and Richard Knerr, learned of a bamboo hoop that children in Australia spun around their waists in gym class. Seizing on the idea, the two men enlisted the Phillips Petroleum company to create a colorful, pliable plastic version, and a gyrating phenomenon took hold, especially among California hipsters.In their first year, 40 million hoops were sold; by 1960, sales had reached 100 million. Contests were held to see who could keep the hoop spinning the longest; the record stands at 74 hours and 52 minutes.Etch A SketchInvented in France, where it was called L’Écran Magique, the drawing toy was a sensation when it was manufactured for the American market in 1960 by the Ohio Art Company. The toys were filled with an aluminum powder and plastic beads that clung to the inside of a screen. Two knobs allowed the user to control a stylus that would draw, or etch, lines — one knob horizontally, the other vertically — through the powder. Carefully turning the knobs simultaneously could produce curves, and some have created intricate works of art.“Its name in France was the Magic Screen, and that paralleled television,” Mr. Bensch said. “Televisions were in black and white; so was Etch A Sketch.”Twister“They said it was like selling sex in a box,” Mr. Bensch said.The game was originally marketed in 1966 for ages 6 and up, but Sears Roebuck wouldn’t list it in its catalog because the company thought the idea was too racy, according to Toys and Games.In the game, a spinner would dictate which limb would go on which enlarged colored dot on a large vinyl floor mat (“Right hand, yellow”; “Left foot, green”). A player who fell would be out of the game.Then one day Johnny Carson demonstrated it on “The Tonight Show” with a guest, the actress Eva Gabor. Millions of people saw them intertwined and giggling, and the game took off, with more than three million copies sold by 1967.Teachers of young children have even found a place for it in classrooms.“You don’t even have to know how to count,” Mr. Bensch said. “You just have to know the right foot from the left foot.”Monopoly The inspiration for Monopoly was called the Landlord’s Game, developed in 1904 by Elizabeth Magie Phillips to show how land-grabbing helped greedy property owners while impoverishing tenants, according to Toys and Games.The game that was later developed by Charles Darrow and bought by Parker Brothers ditched the moral lessons, and suddenly, bankrupting friends and family members became a favorite pastime in millions of households.For just $1, the game was a worthwhile investment during the Great Depression.“It was hours of occupation, fun and socializing that you could keep enjoying again and again,” Mr. Bensch said. “It’s a testimonial to the right thing at the right time.”"
58c15fe67c459f247962e223,Hari Kunzru: By the Book,2017-03-09,https://www.nytimes.com/2017/03/09/books/review/hari-kunzru-by-the-book.html,The New York Times,"The author, most recently, of “White Tears” says it might be nice to give Theresa May a book that shows England from an outsider’s perspective: She “strikes me as the kind of Tory who has read too much Trollope and not enough of anything else.”What books are currently on your night stand?An anthology of Pasolini’s writings called “In Danger”; “Journal of an Ordinary Grief,” by the Palestinian poet Mahmoud Darwish; another anthology of recent political poetry and prose called “Anguish Language: Writing and Crisis”; and a proof of Margaret Jull Costa’s new translation of Pessoa’s “The Book of Disquiet,” which I’m particularly excited to read, as somehow I could never make headway with the older English translation and have hopes that at last this famous book will break open for me.What’s the last great book you read?Like a lot of people, I suspect, given the political situation, I’ve been rereading James Baldwin. I’m working through the Library of America edition of the collected essays. So I could say “The Fire Next Time.”What classic novel did you recently read for the first time?I spent the first half of last year living in Berlin, as a fellow at the American Academy. It was the perfect place to read Thomas Mann’s “The Magic Mountain.” I used to eat breakfast with the other fellows and secretly imagine we were all inmates in a sanatorium.What’s your favorite book no one else has heard of? I don’t know if it counts as particularly obscure, since it’s in print as a Penguin Classic, but I think more people should read Count Jan Potocki’s bizarre Gothic fantasy, “The Manuscript Found in Saragossa.” The vastly wealthy Polish traveler and dilettante wrote it in the years before his suicide in 1815, but it wasn’t published until much later. Set in Spain, it tells dozens of interlocking stories, involving kabbalists, bandits, shape-shifters, cannibal Gypsies, the Wandering Jew and an underground Muslim society. As in, literally underground, in mountain caves, driven into secrecy by the Reconquista.What moves you most in a work of literature?The feeling that the writer is putting him- or herself at risk, either by excavating something uncomfortable or embarrassing, or just by scrupulously trying to tell a difficult truth.Which genres do you especially enjoy reading? And which do you avoid?As a teenager, for several years I read nothing but fantasy and science fiction. Later my tastes changed, and as a self-conscious young would-be literary writer I was embarrassed by my S-F days. Later I went back and began to read it again, rather gingerly, never with the same absorption or commitment as when it had colonized my entire imagination, but with pleasure. Recently I’ve enjoyed Ted Chiang’s “Stories of Your Life” and Charles Stross’s “Accelerando.”How do you like to read? Paper or electronic? One book at a time or simultaneously? Morning or night?Perhaps I’d own an e-reader if they didn’t track what you were doing. I find that an intolerable invasion of privacy, a red line. I read PDFs on an iPad, but otherwise it’s all paper, several books at a time. I am always surrounded by teetering ‘to-read’ piles. I have small children, so I get a fraction of the reading time I used to, mostly after they’ve gone to bed.How do you organize your books?What is acceptable New York Times style for conveying hollow cackling laughter?What book might people be surprised to find on your shelves?I have a small collection of mystical U.F.O. and spiritualist ephemera, such as a series of pamphlet interviews with the ghosts of famous dead people (Rembrandt, Einstein, etc.) and a record of a conversation between Jesus and “an Earth person” which took place “hundreds of miles from Earth in the purple magnificence of star-studded Space” in 1959. I recently bought a lot of old nurse-romance paperbacks on eBay. I have no idea what I will do with nurse-romance paperbacks, but it seems like there might be some kind of tone or format that I could mine them for.What’s the best book you’ve ever received as a gift?My wife gave me a copy of the Japanese experimental director Shuji Terayama’s photo book “The People of the Dog-God Family.” The people are exquisite and surreal and perverse. It’s a beautiful object, and a hard book to find.If you could require the prime minister to read one book, what would it be? The American president?Theresa May strikes me as the kind of Tory who has read too much Trollope and not enough of anything else. It might be nice to give her a book that shows England from an outsider’s perspective, perhaps Sam Selvon’s “The Lonely Londoners.” Or something by Victor Serge, though that would just be trolling. I think the president might benefit from a basic civics textbook, something with large print.Disappointing, overrated, just not good: What book did you feel you were supposed to like, and didn’t? Do you remember the last book you put down without finishing?I start a lot of contemporary novels and don’t finish them. Often I don’t get beyond the first couple of chapters. I used to force myself to finish everything I started, which I think is quite good discipline when you’re young, but once you’ve established your taste, and the penny drops that there are only a certain number of books you’ll get to read before you die, reading bad ones becomes almost nauseating.What do you plan to read next?Other than the things on my night stand? I’m writing something set in Berlin, and working hard, if frustratingly slowly, on my German. I’m going to read the East German dissident Jürgen Fuchs’s “Vernehmungsprotokolle” (“Interrogation Records”), accounts of his conversations with his interrogators while a detainee of the Stasi in Hohenschönhausen prison. I also have the poet Monica Youn’s collection “Blackacre,” which might be quite a good way to take my mind off German compound words about surveillance."
ID,Headline,Date,Url,Source,Content
543866db38f0d83c143b9608,Citro&euml;n&#8217;s U.F.O. Spawns a Brand ,2014-10-12,https://www.nytimes.com/2014/10/12/automobiles/citroens-ufo-spawns-a-brand.html,The New York Times,
595e7aa47c459f246b617a3b,9 Ways ‘Twin Peaks: Fire Walk With Me’ Connects to the Series Revival,2017-07-06,https://www.nytimes.com/2017/07/06/watching/twin-peaks-the-return-fire-walk-with-me-connections.html,The New York Times,
57ae7b617c459f21c9994fae,What’s on TV Thursday: Simone Biles in Rio and ‘Triumph’s Summer Election Special 2016’,2016-08-11,https://www.nytimes.com/2016/08/11/arts/television/whats-on-tv-thursday-simone-biles-in-rio-and-triumphs-summer-election-special-2016.html,The New York Times,"Simone Biles, the Final Five’s not-so-secret weapon, goes for the all-around gold in women’s gymnastics at the Rio Olympics. Triumph the Insult Comic Dog returns to the presidential campaign trail. And for pure summer fun, screen all of Idris Elba’s “Luther.” RIO OLYMPICS 8 p.m. on NBC. After taking the gold as part of the American women’s gymnastics team — or Final Five, a nickname the members chose in tribute to their retiring coach, Martha Karolyi — Simone Biles goes for the crown in the all-around. And the swimmer Michael Phelps faces his teammate Ryan Lochte in the finals of the 200-meter individual medley. A schedule is at NBCOlympics.com.CLOSE ENCOUNTERS OF THE THIRD KIND (1977) 9 p.m. on Starz. An electrical lineman (Richard Dreyfuss) in Indiana finds life changed for the weirder after a run-in with an unidentified flying object in Steven Spielberg’s sci-fi classic. François Truffaut, one of Mr. Spielberg’s film heroes, played the French scientist at the helm of an international U.F.O. team — and in his free time worked on the script for “The Man Who Loved Women.” It’s spectacular throughout, in a disco kind of way, Vincent Canby wrote in The New York Times. But the film’s last 40 minutes “are what it’s all about — and they are breathtaking.”TRIUMPH’S SUMMER ELECTION SPECIAL 2016 on Hulu. Triumph the Insult Comic Dog reports from the conventions, photobombs Anderson Cooper and commandeers a Westboro Baptist Church demonstration.LUTHER on iTunes. His beard is flecked with gray now, his soul bedeviled by the ghost of Alice Morgan. And you can’t help wondering what’s lurking in his head. But when D.C.I. John Luther regains his senses more than a year after abandoning us on Southwark Bridge and swaggers — as only Idris Elba can — into London, you’ll swear you feel the world right itself on its axis. Mr. Elba earned his fourth Emmy nomination for this signature role, which this season amounts to a two-episode hide-and-seek with a cannibalistic serial killer. And for more of Ruth Wilson after her delicious turn as Morgan, check out “The Affair” on Showtime.com and Amazon.OCCUPIED on Netflix. In the near future in Norway, the government decides to address climate change by cutting off oil and gas production, plunging Europe into a crisis and prompting an intervention led by Russia. The United States, meanwhile, has withdrawn from NATO. Henrik Mestad stars as Prime Minister Jesper Berg, determined to stay in power until the situation calms down; Eldar Skar is Hans Martin Djupvik, his bodyguard. The crime writer Jo Nesbo conjured up the situation behind this series, the most expensive ever made in Norway."
