ID,Headline,Date,Url,Source,Content
561199c738f0d86550b96560,"Jim Shaw, From Trash Bins and Swap Meets, a Prodigious Body of Work",2015-10-05,https://www.nytimes.com/2015/10/05/arts/design/jim-shaw-from-trash-bins-and-swap-meets-a-prodigious-body-of-work.html,The New York Times,"ALTADENA, Calif. — The artist Jim Shaw, whose retrospective opens on Wednesday at the New Museum in Manhattan, works in a modest converted house here on the outskirts of Los Angeles amid such a jumble of paintings and drawings it seems as if you could extract at least another three retrospectives out of it.The mess is not exactly Collyer brothers level, but the other afternoon Mr. Shaw had to dig through layers of works in progress to unearth a box with a book he wanted to give to a reporter. The box crowded the furniture in the living room along with two old church organs, his studio manager’s Irish wolfhound and shelves bulging with titles like “Jokes for the John” and “Petroleum Collectibles.”“For a lot of the things that I buy on eBay,” said Mr. Shaw, 63, in the middle of a meandering studio tour, “I’m the only bidder.”The clutter is in keeping with the nature of an artist who has rummaged more thoroughly and strangely than almost any of his generation through the trash bins and swap meets of 20th-century American culture, forging a prodigious body of work that melds his eccentric collections with his comic-Surrealist paintings — and in a way that makes it hard to separate the two. As the critic Christopher Knight has written, Mr. Shaw “debunks the modernist myth of art as keeper of an ultimate, essential truth,” while being “sincerely obsessed with the perfectly human search for spiritual peace.”His career has prowled the vicinities of fringe churches, cults, dangerous political movements, visionary art scenes and failed philosophies — and the ways they try to represent themselves visually and verbally — making him into what might be called an underground artist’s underground artist. (Though he is one who, in keeping with the sort of contradiction he loves, shows at an important New York gallery, Metro Pictures).If you wanted to know more, for example, about the U.F.O. society known as the Unarius Academy of Science, with publications like “The Voice of Orion”; or about Jack Chick’s disturbing religious tracts; or about American Freemasonry; or how the Branch Davidians are related to the Millerites; or about the 1970s extravaganzas of the Rev. O. Lee Jaggers and Miss Velma (married first cousins) at their Universal World Church in Los Angeles, Mr. Shaw is one-stop shopping.The New Museum show, “The End Is Here,” which runs through Jan. 10, will be a kind of reunion tour for a body of work that Mr. Shaw is perhaps best known for, his vast collection of thrift store paintings, which made their first gallery appearance in New York in 1991, in an exhibition that has come to be revered for its unexpected impact on the ways people thought about painting at the time. A selection, from some 400 canvases that were eventually acquired as a group by a Brussels collector, are now back in New York, along with others that Mr. Shaw has collected recently, grouped into categories like “religious paintings” and “the depressed ex-girlfriend section.”“Jim has always been very important and influential to me because of the way he blurs the distinction between insider art and outsider art, which is something I’ve been involved with for a long time,” said Massimiliano Gioni, the New Museum’s associate director and director of exhibitions and the curator of its show, along with Gary Carrion-Murayari and Margot Norton.“I think he is progressively fascinated by forms of visual culture at the moment of their disappearance,” Mr. Gioni added, describing Mr. Shaw’s obsessive collections of amateur art, religious tracts and other cultural castoffs as “an iconographic sanctuary.”Mr. Shaw, who has lived and worked in Los Angeles since the 1970s, grew up in Midland, Mich., the home of Dow Chemical, where his father was a product designer. Along with the artist Mike Kelley, a fellow student at the University of Michigan, Mr. Shaw was a founder of the short-lived but influential punk-noise band Destroy All Monsters. And along with Mr. Kelley and Paul McCarthy, another Los Angeles transplant from further east, Mr. Shaw became known in the 1980s and 1990s for a creepy brand of art – sometimes identified under the catchall term “abject” — that took a good, hard look at the hairy underbelly of the American dream.Mr. Shaw’s work in particular, Mr. Gioni said, holds tight, without irony or condescension, to “forms of visual culture that would otherwise go away — and indirectly what he collects and shows becomes a commentary on what a museum is, who gets to preserve these stories and cultures and how they get shown.”While Mr. Kelley, who died in 2012, and Mr. McCarthy became highly successful in the commercial art world, Mr. Shaw still speaks about his career like a kind of middle manager at an office supply company, mentioning his mortgage and the outrageous costs of education. (Mr. Shaw is married to the artist Marnie Weber and they have a teenage daughter.) While there is some false modesty in this, Mr. Shaw, who worked for years in Hollywood special-effects departments to pay the bills, said he had never really been able to adjust the calculus of his artistic obsessions to the art world’s desires.“I just came to the conclusion that if I tried to make things for the market, it was never going to work,” he said during the studio walk-through, wearing badly stained khakis, a turquoise Hawaiian shirt and a pair of reading glasses on his nose in front of his regular glasses. Showing off a large new painting, almost completed, of a surrealist landscape scattered with jars holding fetuses, he fake-grimaced and said, “I have no idea who’s going to want to buy that.”In some ways, Mr. Shaw’s career has suffered under the shadow of Mr. Kelley’s, a close friend with whom he shared many interests — comic book characters, underground cultures, vernacular traditions twisted by Pop culture. But with the retrospective, and a huge show of his work that opened in March and also closes in January at the Massachusetts Museum of Contemporary Art in North Adams, Mr. Shaw is getting the kind of attention that his work, which has been followed for many years in Europe, has never had in the United States.It’s not easy, through his bone-dry, unassuming demeanor, to tell quite how he feels about that. But last week, back in New York to help hang the show, he looked up admiringly at large, kooky religious banners — ones he came across years ago at the Pasadena City College flea market — hanging prominently in the middle of the museum’s third floor. One banner’s hand-painted message seemed to comically invoke Mr. Shaw’s quasi-religious career itself: “Rightly Dividing the Word of Truth.”Mr. Shaw looked around and shook his head. “There’s so much more that could be in here, you know,” he said."
ID,Headline,Date,Url,Source,Content
557672dd38f0d8639f6de322,What’s on TV Tuesday,2015-06-09,https://www.nytimes.com/2015/06/09/arts/television/whats-on-tv-tuesday.html,The New York Times,"1 P.M. (SYFY) THE PRESTIGE (2006) Robert Angier (Hugh Jackman) and Alfred Borden (Christian Bale) work together as assistants in magic performances before a tragedy turns them into lifelong enemies. As performing magicians, they seek vengeance on each other through obsessive one-upmanship. Rebecca Hall and Michael Caine play supporting roles as Angier’s wife and his manager. “ ‘The Prestige,’ directed by Christopher Nolan from a script he wrote with his brother Jonathan, is an intricate and elaborate machine designed for the simple purpose of diversion,” A. O. Scott wrote in The New York Times. “Set in a stylized late-Victorian world of dueling music-hall magicians and diabolically clever inventors, it has a satisfyingly puzzlelike structure, zipping around in time and scattering clues throughout its busy scenes and frames. Like ‘Memento,’ also directed by Christopher Nolan and based on a story by his brother, ‘The Prestige’ is a triumph of gimmickry, a movie generous enough with its showmanship and sleight of hand to quiet the temptation to grumble about its lack of substance.”8 P.M. (Fox) ARE YOU SMARTER THAN A 5TH GRADER Jeff Foxworthy hosts this quiz show, in which adults must answer geography, math and social studies questions from elementary school in a competition for $1 million. If the contestants are stumped, they can enlist the help of real fifth graders.8 P.M. (ABC Family) PRETTY LITTLE LIARS Aria (Lucy Hale), Emily (Shay Mitchell), Hanna (Ashley Benson) and Spencer (Troian Bellisario) try to recover from their experience as captives in the Dollhouse. A suspect is in custody, but no one feels safe. Alison (Sasha Pieterse) confronts the reputation she has earned.8 P.M. (IFC) FAST TIMES AT RIDGEMONT HIGH (1982) Cameron Crowe wrote the screenplay for this movie and the book it is based on by posing as a high school student for a year. The film, directed by Amy Heckerling, follows teenagers (Sean Penn, Jennifer Jason Leigh, Phoebe Cates, Judge Reinhold and others) as they concern themselves with the mall, fast-food jobs, sex and surfing. “Can there be anything about life in high school, particularly life in a suburban California high school, that the moviegoing public hasn’t already seen?” Janet Maslin wrote in The Times. “Well, maybe there can. A little bit of it turns up in ‘Fast Times at Ridgemont High,’ a jumbled but appealing teenage comedy with something of a fresh perspective on the subject.”9 P.M. (The CW) IZOMBIE Liv (Rose McIver) and Clive (Malcolm Goodwin) discover new evidence in the Max Rager case, which spurs them to visit Vaughn Du Clark (Steven Weber). Blaine (David Anders) has a proposition for Liv, and Major (Robert Buckley) winds up in a crazy situation in this season finale.9 P.M. (Fox) HELL’S KITCHEN The chef Gordon Ramsay has staged the final challenge between the two remaining contestants. One will be selected as a winner and awarded a head chef position at Caesars Atlantic City in this season finale.9 P.M. (Cooking Channel) JUNK FOOD FLIP The U.F.O. is a 1,500-calorie burrito at A1A Burrito Works Taco Shop in St. Augustine Beach, Fla. The chefs Bobby Deen and Nikki Dinki must figure out how to remake the burrito as a healthy fuel source for area surfers, cyclists and runners while preserving its delicious attributes. If people like their version, it goes on the menu, and if not, the owners win cash.10 P.M. (Food Network) CHOPPED The judges compete in using baskets full of leftovers to make dishes. The ingredients include tuna noodle casserole, rice left in a pan and old cake.What’s Streaming NowTHE BRIDGE When a body is found lying on the United States-Mexico border, detectives from both countries — Sonya Cross (Diane Kruger) and Marco Ruiz (Demian Bichir) — investigate and find themselves in a world of corruption and drug crime. This drama, adapted from Scandinavian television, is now streaming on Hulu. “We can enjoy the cinematography, which really is first-rate, along with the show’s primary blessing, the performances of Mr. Lillard, Ms. Kruger and particularly Mr. Bichir,” Mike Hale wrote in The Times. “His weary eyes and aching body language tell us most of what we need to know about border issues.” (hulu.com)"
561c749138f0d84d2f3b8b0d,&#8216;Fargo&#8217; Season 2 Premiere Recap: &#8216;Waiting for Dutch&#8217;,2015-10-12,https://artsbeat.blogs.nytimes.com/2015/10/12/fargo-season-2-premiere-recap-what-is-this-show-supposed-to-be/,The New York Times,
5639d72e38f0d8786b6fe513,The Weaponization of ‘Truther’,2015-11-04,https://www.nytimes.com/2015/11/08/magazine/the-weaponization-of-truther.html,The New York Times,"What does it mean to be a ‘‘truther’’?We are all supposedly on journeys to truth. I had a rabbi tell me this once. And to be an agent of truth — a truth-­teller — is a noble thing. We praise journalists, gadflies, investigators or even politicians that speak ‘‘truth to power’’ and tell ‘‘hard truths’’ and unearth the ‘‘inconvenient truths’’ that defy official narratives and alter our destinies.But it is not flattering to be called a ‘‘truther.’’ The term originated, as far as anyone can tell, to characterize people who embraced alternative explanations for the Sept. 11 attacks. In 2006, The New York Times published an article about a convention in Chicago — dubbed the ‘‘International Education and Strategy Conference for 9/11 Truth’’ — in which alternative theories about the terrorist attacks were discussed. The report, by Alan Feuer, included a neutral description of 9/11 truthers, whom he characterized as a group with a ‘‘rank and file’’ that included ‘‘professors, chain-saw operators, mothers, engineers, activists, used-­book sellers, pizza deliverymen, college students, a former fringe candidatefor United States Senate and a long­haired fellow named hummux (pronounced ‘who-­mook’) who, on and off, lived in a cave for 15 years.’’A truther stereotype was born — and mutated. Today, anyone who subscribes to or perpetuates less-­mainstream or in some cases deeply offensive versions of accepted scenarios becomes susceptible to the dreaded ‘‘er’’ suffix. Add ‘‘er,’’ dismiss as nuts (rinse and retweet). It suggests a position on the fringe in the same way that, say, adding ‘‘gate’’ signifies a scandal. So why is it good to tell the truth but bad to be a truther?Consider a recent object lesson of supposed trutherism. It occurred a few weeks ago in the Republican presidential campaign — and of course involves Donald, the Trumper. ‘‘When you talk about George Bush,’’ the then-­maybe-­front-­runner said of the 43rd president during an interview on Bloomberg TV, ‘‘I mean, say what you want, the World Trade Center came down during his time.’’‘‘Hold on,’’ the Bloomberg anchorwoman Stephanie Ruhle said. ‘‘You can’t blame George Bush for that.’’And why not? ‘‘He was president, O.K.?’’ Trump countered. ‘‘Blame him or don’t blame him, but he was president. The World Trade Center came down during his reign.’’In a technical sense, Trump had truth on his side. George W. Bush was, in fact, the president on Sept. 11, 2001. (As an aside, I was struck by Trump’s curiously authoritarian use of ‘‘reign’’ to describe the tenure of an American president.) Trump did not explicitly assign blame to Bush, or say whether he could have done anything to prevent the attacks. But by raising the matter of blame, Trump was defying yet another truth that Republicans had until that point held to be self-­evident: that W. held no culpability for anything that happened on 9/11.There was an often-­cited warning in the President’s Daily Brief from August 2001 cautioning that Osama bin Laden was ‘‘determined to strike in U.S.’’ But the general inclination, at least among Republicans, has been to cut Bush slack on this and credit him with ‘‘keeping America safe.’’ Trump’s remark had Bush’s defenders firing up their umbrage machines. ‘‘How pathetic for @realdonaldtrump to criticize the president for 9/11,’’ Jeb Bush tweeted. ‘‘We were attacked & my brother kept us safe.’’ Ari Fleischer, a Bush White House press secretary, took it further, breaking out the heavy er-­tillery, telling CNN: ‘‘When Trump implies that since 9/11 took place on Bush’s watch he is partially responsible for it, he’s starting to sound like a truther,’’ he said. ‘‘And after all, does Donald Trump also think since Pearl Harbor happened on F.D.R.’s watch that F.D.R. is responsible?’’Trump has always been more associated with ‘‘birthers’’ than ‘‘truthers.’’ ‘‘Birther,’’ of course, is the common ‘‘er’’ reserved for those who believe that President Obama’s birth certificate might be fake, that he was born outside the United States and that his presidency is therefore not legitimate. Trump was a vocal proponent of this view in the 2012 presidential campaign, which he made many loud noises about joining but ultimately did not. His apparent fixation on the cause was enough for many to consign him to the nativist fringe of the Republican Party, or so it seemed. It also contributed enough doubt that it compelled Obama to actually release his long-­form birth certificate at a White House news conference in 2011.Trump has largely avoided discussing the Obama birth-­certificate issue in this campaign. He is an avowed non­fan of the word ‘‘birther,’’ which he told Politico in 2012 was ‘‘a derogatory term, created by a certain group in the media’’ (he instead called it Obama’s ‘‘place-­of-­birth issue’’). But to this point, trutherism in its original 9/11 sense has never really been Trump’s thing. Fleischer told me that he intentionally used the word ‘‘truther’’ as an epithet. In a sense, he was counterpunching in a classically Trumpian style — floating a notion and letting it hang there to absorb sinister connotations. Trump ‘‘did what people who want to hang dirty innuendos do, which is Donald Trump style,’’ Fleischer said. ‘‘He made the allegation that Bush was somehow to blame, without saying how or why.’’ Fleischer said that Trump did a similar thing recently when he brought up Ben Carson’s Seventh-­day Adventist faith and discussed it in a way that suggested he was confused. ‘‘I just don’t know’’ about Seventh-­day Adventists, Trump said, leaving an information vacuum for sinister thoughts to flourish.Trump, Fleischer said, was inviting listeners to conflate legitimate questions of Bush’s handling of pre-9/11 intelligence with more easily dismissed (or screwball) notions. ‘‘I’m not going to give Donald Trump the benefit of the doubt about anything he leaves unsaid,’’ he told me. Fleischer is unaligned in the Republican primary race and says he is not a truther or a birther or any kind of ‘‘er’’ except for a ‘‘Fleischer’’ — which he says could refer to someone (like himself) who does not believe recent studies equating the consumption of certain red meats with an increased risk of cancer. ‘‘I don’t buy the bacon stories,’’ Fleischer said. ‘‘That means I’m a Fleischer.’’ Or a ‘‘Flesher.’’It’s difficult to pinpoint exactly when ‘‘truther’’ became so readily weaponized. In debates about previous conspiracy theories, no one used terms like, say, ‘‘Kennedy assassination truther.’’ No one dismissed as ‘‘Elvis truthers’’ those who believed that Elvis Presley remained alive. A recent Rawstory.com headline identified Rage Against the Machine’s bassist, Tim Commerford, as a ‘‘moon-­landing truther,’’ although no one would have used such a term at the time of the actual — or alleged — moon landing.But after that 2006 Times article, truthers were suddenly everywhere. Subsequent reports — in The Washington Post, Vanity Fair and U.S. News & World Report — all made reference to 9/11 ‘‘truthers,’’ although it took a while for the word to acquire its full-on wacko connotation. In recent years, ‘‘truther’’ has come to have its own totally discrete constellation of evolving meanings and history. Social media, as it tends to do, has accelerated the process.After NASA recently reported that scientists had found signs of water on Mars, some skeptics dismissed the news as concocted, in the words of Rush Limbaugh, to ‘‘help advance their left-wing agenda on this planet.’’ Newsweek presented these counterarguments under the headline ‘‘Mars Conspiracy ‘Truthers’ React to NASA’s Water Announcement.’’ Vice recently profiled a ‘‘drought truther’’ who maintained that the catastrophic lack of rain in California was caused by ‘‘a secret weather-­control operation orchestrated by the Powers That Be, part of a doomed attempt by government geoengineers to stop global warming.’’ ‘‘Stevie Wonder truthers’’ have questioned whether the singer is in fact blind or is just faking it (for some reason). The foremost Wonder truther, Bomani Jones of ESPN, cited as evidence a guy who claimed to have sold Wonder three TVs. Jones later acknowledged to me, in an interview for this magazine, that his Wonder trutherism was ‘‘a somewhat inappropriate joke that has taken on a life of its own.’’You can’t help wondering how many sectors of trutherism begin similarly — goofs that spin out of control, to a point at which they are taken quasi-­seriously. The Internet is a supercollider of alternative interpretations — if not realities — and the people who embrace them. People then marginalize those views by calling perpetrators truthers. Things can get very pitched in short order. Every topic — Benghazi, droughts and Mars — becomes a potential battlefield between information and misinformation, truth and truthers.Trutherism can quickly become stranger than fiction, whatever is which. It becomes a thing, if not a meme. Our individual journeys to truth play out via search engine. You long for a less-­networked, less­-noisy and less-­dismissive community of believers versus skeptics. Or at least I do. Is it me or did conspiracy theorizing and mythmaking used to be so much more fun? I miss the Sasquatch and Area 51 people. ‘‘The truth is out there,’’ as the U.F.O. buffs used to say. And they used to be ‘‘buffs,’’ not ‘‘truthers,’’ in those days of greater innocence and less dismissiveness, before the truthers were out there, too."
